[
  {
    "date": "2023-11-01",
    "category": "npdes_public_notice",
    "title": "NPDES 2PD00013*VD (City of Defiance Water Pollution Control (WPC)) — public notice",
    "ref": "2PD00013*VD",
    "parties": [
      "City of Defiance, 631 Perry Street, Defiance, OH 43512",
      "City of Defiance Water Pollution Control (WPC)"
    ],
    "detail": "action renewal; receiving Maumee River",
    "source": "oepa/defiance/2PD00013.fs.npdes.yaml",
    "also_sources": [],
    "citation": {
      "source": "oepa/defiance/2PD00013.fs.npdes.yaml",
      "source_kind": "document",
      "page": null,
      "pages": null,
      "confidence": "medium",
      "note": null,
      "verified": true
    }
  },
  {
    "date": "2023-11-30",
    "category": "npdes_comment_deadline",
    "title": "NPDES 2PD00013*VD (City of Defiance Water Pollution Control (WPC)) — comment period ends",
    "ref": "2PD00013*VD",
    "parties": [
      "City of Defiance, 631 Perry Street, Defiance, OH 43512",
      "City of Defiance Water Pollution Control (WPC)"
    ],
    "detail": "",
    "source": "oepa/defiance/2PD00013.fs.npdes.yaml",
    "also_sources": [],
    "citation": {
      "source": "oepa/defiance/2PD00013.fs.npdes.yaml",
      "source_kind": "document",
      "page": null,
      "pages": null,
      "confidence": "medium",
      "note": null,
      "verified": true
    }
  }
]
