[
  {
    "date": "2025-12-05",
    "category": "epa_permit_action",
    "title": "401 Water Quality Certification and Isolated Wetland Permit 495265945 — application (Project Dazzler)",
    "ref": "495265945",
    "parties": [
      "Tilted Gate LLC",
      "Heather Dardinger",
      "EMH&T"
    ],
    "detail": "affected jurisdictional wetland, isolated wetlands, and a non-jurisdictional pond",
    "source": "permits/dazzler-permits/4081897.epa.yaml",
    "also_sources": [],
    "citation": {
      "source": "permits/dazzler-permits/4081897.epa.yaml",
      "source_kind": "document",
      "page": null,
      "confidence": "medium",
      "note": null,
      "verified": true
    }
  },
  {
    "date": "2026-01-07",
    "category": "epa_permit_action",
    "title": "Section 404 / Waters of the United States Investigation (Jurisdictional Determination) 20250390 — application (Project Dazzler)",
    "ref": "20250390",
    "parties": [
      "Tilted Gate LLC",
      "EMH&T"
    ],
    "detail": "affected Waters of the United States, including wetlands, streams, ponds, and other surface water features; approximately 914-acre property in Green Township, Scioto County, Ohio",
    "source": "permits/dazzler-permits/4071697.epa.yaml",
    "also_sources": [],
    "citation": {
      "source": "permits/dazzler-permits/4071697.epa.yaml",
      "source_kind": "document",
      "page": null,
      "confidence": "medium",
      "note": null,
      "verified": true
    }
  },
  {
    "date": "2026-01-07",
    "category": "epa_permit_action",
    "title": "Section 404 / Waters of the United States Investigation (Jurisdictional Determination) — application (Project Dazzler)",
    "ref": "",
    "parties": [
      "Tilted Gate LLC",
      "EMH&T (Engineers, Surveyors, Planners, Scientists)"
    ],
    "detail": "affected Waters of the United States, including wetlands, streams, ponds, and other surface water features; Ginat Creek subbasin (HUC: 05090103-01-06) and Grays Branch-Ohio River subbasin (HUC: 05090103-01-07)",
    "source": "permits/dazzler-permits/4081896.epa.yaml",
    "also_sources": [],
    "citation": {
      "source": "permits/dazzler-permits/4081896.epa.yaml",
      "source_kind": "document",
      "page": null,
      "confidence": "medium",
      "note": null,
      "verified": true
    }
  },
  {
    "date": "2026-02-05",
    "category": "epa_permit_action",
    "title": "Section 404 / Jurisdictional Determination LRH-2025-00939-OHR — correspondence (Project Dazzler Property)",
    "ref": "LRH-2025-00939-OHR",
    "parties": [
      "Randy Barrera, Tilted Gate, LLC",
      "Katie Samples",
      "EMH&T"
    ],
    "detail": "affected Wetlands (23.18 acres, 6 wetlands), streams (14,306 linear feet, 8 streams including Ohio River), open water marina (6.52 acres); and non-jurisdictional wetlands (36.15 acres, 43 wetlands), streams, swales, ditch, drainage feature, and ponds",
    "source": "permits/dazzler-permits/4081903.epa.yaml",
    "also_sources": [],
    "citation": {
      "source": "permits/dazzler-permits/4081903.epa.yaml",
      "source_kind": "document",
      "page": null,
      "confidence": "medium",
      "note": null,
      "verified": true
    }
  },
  {
    "date": "2026-04-01",
    "category": "epa_permit_action",
    "title": "Huntington In-Lieu Fee Program (Wetland Mitigation) LST-002 — correspondence (Project Dazzler Site Wetland Mitigation)",
    "ref": "LST-002",
    "parties": [
      "Randy Barrera, Tilted Gate LLC",
      "Heather Dardinger",
      "EMH&T"
    ],
    "detail": "affected Jurisdictional wetlands / aquatic resources — 5.2 acres forested wetland mitigation credits and 2.2 acres non-forested wetland mitigation credits",
    "source": "permits/dazzler-permits/4071709.epa.yaml",
    "also_sources": [
      "permits/dazzler-permits/4081908.epa.yaml"
    ],
    "citation": {
      "source": "permits/dazzler-permits/4071709.epa.yaml",
      "source_kind": "document",
      "page": null,
      "confidence": "medium",
      "note": null,
      "verified": true
    }
  },
  {
    "date": "2026-04-03",
    "category": "epa_permit_action",
    "title": "Section 404 / 401 Water Quality Certification — application (Project Dazzler)",
    "ref": "",
    "parties": [
      "Tilted Gate LLC",
      "EMH&T"
    ],
    "detail": "affected Jurisdictional waters of the U.S. (wetlands, streams, open waters)",
    "source": "permits/dazzler-permits/4071710.epa.yaml",
    "also_sources": [],
    "citation": {
      "source": "permits/dazzler-permits/4071710.epa.yaml",
      "source_kind": "document",
      "page": null,
      "confidence": "medium",
      "note": null,
      "verified": true
    }
  },
  {
    "date": "2026-04-03",
    "category": "epa_permit_action",
    "title": "Section 404 / 401 Water Quality Certification 20250390 — application (Project Dazzler)",
    "ref": "20250390",
    "parties": [
      "Tilted Gate LLC",
      "EMH&T"
    ],
    "detail": "",
    "source": "permits/dazzler-permits/4081909.epa.yaml",
    "also_sources": [],
    "citation": {
      "source": "permits/dazzler-permits/4081909.epa.yaml",
      "source_kind": "document",
      "page": null,
      "confidence": "medium",
      "note": null,
      "verified": true
    }
  },
  {
    "date": "2026-04-14",
    "category": "epa_permit_action",
    "title": "401 Water Quality Certification LRH-2025-00939OHR — application (Project Dazzler)",
    "ref": "LRH-2025-00939OHR",
    "parties": [
      "Tilted Gate LLC",
      "Heather Dardinger",
      "EMH&T"
    ],
    "detail": "affected Wetlands (3.12 acres), Ginat Creek watershed (HUC 050901030106), Grays Branch-Ohio River watershed (HUC 050901030107)",
    "source": "permits/dazzler-permits/4081890.epa.yaml",
    "also_sources": [],
    "citation": {
      "source": "permits/dazzler-permits/4081890.epa.yaml",
      "source_kind": "document",
      "page": null,
      "confidence": "medium",
      "note": null,
      "verified": true
    }
  },
  {
    "date": "2026-04-14",
    "category": "epa_permit_action",
    "title": "Section 404 LRH-2025-00939-OHR — application (Project Dazzler)",
    "ref": "LRH-2025-00939-OHR",
    "parties": [
      "Timothy Chadwick, Tilted Gate LLC"
    ],
    "detail": "affected 3.12 acres of one (1) wetland (Wetland P), including 2.05 acres of forested wetland and 1.07 acres of emergent wetland; waters of the United States",
    "source": "permits/dazzler-permits/4081910.epa.yaml",
    "also_sources": [],
    "citation": {
      "source": "permits/dazzler-permits/4081910.epa.yaml",
      "source_kind": "document",
      "page": null,
      "confidence": "medium",
      "note": null,
      "verified": true
    }
  }
]
