[
  {
    "date": "2020-03-04",
    "category": "enforcement_order",
    "title": "Ohio EPA correspondence — City of Mansfield (Mr. Robert Coker Jr., WWTP Manager)",
    "ref": "order-2PE00000-2020-03-04-correspondence",
    "parties": [
      "City of Mansfield (Mr. Robert Coker Jr., WWTP Manager)",
      "Ohio EPA"
    ],
    "detail": "1 obligation(s); ⚠️ MISFILED AT THE AGENCY, AND SHELVED WITH ITS SOURCE ANYWAY. This document's subject is the MANSFIELD WWTP in RICHLAND County — not Lima,…",
    "source": "oepa/lima/edoc-3063821.order.yaml",
    "also_sources": [],
    "citation": {
      "source": "oepa/lima/edoc-3063821.order.yaml",
      "source_kind": "document",
      "page": null,
      "pages": null,
      "confidence": "medium",
      "note": null,
      "verified": true
    }
  }
]
